Ticker,Date,Title,Description,Source,URL
AAPL,2025-04-28 11:00:00+00:00,Apple Stock Earnings Preview: Things To Consider Before The Next Report,Examine the key factors to watch before the next Apple earnings report to help you make informed decisions on AAPL.,Forbes,https://www.forbes.com/sites/investor-hub/article/apple-aapl-stock-earnings-things-to-consider/
AAPL,2025-04-28 07:38:13+00:00,Market Volatility Is About To Make An Explosive Return,"Analyst’s Disclosure: I/we have a beneficial long position in the shares of MSFT,AMZN,AAPL either through stock ownership, options, or other derivatives. I wrote this article myself, and it expresses my own opinions. I am not receiving compensation for it (ot…",Biztoc.com,https://biztoc.com/x/3533ca4cf89fb32b
AAPL,2025-04-28 07:08:51+00:00,Apple Inc. (NASDAQ:AAPL) Stake Lowered by Mattern Capital Management LLC,"Mattern Capital Management LLC lessened its holdings in shares of Apple Inc. (NASDAQ:AAPL – Free Report) by 3.6% during the 4th quarter, according to its most recent 13F filing with the SEC. The institutional investor owned 82,438 shares of the iPhone maker’s…",ETF Daily News,https://www.etfdailynews.com/2025/04/28/apple-inc-nasdaqaapl-stake-lowered-by-mattern-capital-management-llc/
AAPL,2025-04-28 07:08:51+00:00,WealthBridge Capital Management LLC Cuts Stock Position in Apple Inc. (NASDAQ:AAPL),"WealthBridge Capital Management LLC reduced its position in Apple Inc. (NASDAQ:AAPL – Free Report) by 0.8% during the fourth quarter, according to the company in its most recent 13F filing with the Securities & Exchange Commission. The institutional investor …",ETF Daily News,https://www.etfdailynews.com/2025/04/28/wealthbridge-capital-management-llc-cuts-stock-position-in-apple-inc-nasdaqaapl/
AAPL,2025-04-28 07:08:50+00:00,Citizens National Bank Trust Department Sells 91 Shares of Apple Inc. (NASDAQ:AAPL),"Citizens National Bank Trust Department lowered its holdings in Apple Inc. (NASDAQ:AAPL – Free Report) by 0.1% during the fourth quarter, according to the company in its most recent filing with the SEC. The fund owned 123,342 shares of the iPhone maker’s stoc…",ETF Daily News,https://www.etfdailynews.com/2025/04/28/citizens-national-bank-trust-department-sells-91-shares-of-apple-inc-nasdaqaapl/
AAPL,2025-04-28 07:08:50+00:00,Apple Inc. (NASDAQ:AAPL) Shares Sold by ING Groep NV,"ING Groep NV lowered its holdings in shares of Apple Inc. (NASDAQ:AAPL – Free Report) by 40.4% during the fourth quarter, according to the company in its most recent Form 13F filing with the Securities and Exchange Commission (SEC). The firm owned 3,649,947 s…",ETF Daily News,https://www.etfdailynews.com/2025/04/28/apple-inc-nasdaqaapl-shares-sold-by-ing-groep-nv/
AAPL,2025-04-28 07:08:50+00:00,First National Bank & Trust Co. of Newtown Decreases Holdings in Apple Inc. (NASDAQ:AAPL),"First National Bank & Trust Co. of Newtown cut its position in Apple Inc. (NASDAQ:AAPL – Free Report) by 5.6% in the fourth quarter, HoldingsChannel.com reports. The firm owned 142,097 shares of the iPhone maker’s stock after selling 8,408 shares during the q…",ETF Daily News,https://www.etfdailynews.com/2025/04/28/first-national-bank-trust-co-of-newtown-decreases-holdings-in-apple-inc-nasdaqaapl/
AAPL,2025-04-28 07:08:50+00:00,Aspen Investment Management Inc Has $4.27 Million Stake in Apple Inc. (NASDAQ:AAPL),"Aspen Investment Management Inc lowered its holdings in shares of Apple Inc. (NASDAQ:AAPL – Free Report) by 1.1% in the 4th quarter, according to its most recent Form 13F filing with the Securities & Exchange Commission. The fund owned 17,043 shares of the iP…",ETF Daily News,https://www.etfdailynews.com/2025/04/28/aspen-investment-management-inc-has-4-27-million-stake-in-apple-inc-nasdaqaapl/
AAPL,2025-04-28 07:08:49+00:00,Apple Inc. (NASDAQ:AAPL) Position Lifted by Wealth Alliance,"Wealth Alliance increased its position in Apple Inc. (NASDAQ:AAPL – Free Report) by 0.5% in the 4th quarter, according to its most recent 13F filing with the Securities and Exchange Commission. The institutional investor owned 361,913 shares of the iPhone mak…",ETF Daily News,https://www.etfdailynews.com/2025/04/28/apple-inc-nasdaqaapl-position-lifted-by-wealth-alliance/
AAPL,2025-04-28 07:08:49+00:00,Apple Inc. (NASDAQ:AAPL) Holdings Trimmed by Laurel Wealth Planning LLC,"Laurel Wealth Planning LLC decreased its stake in Apple Inc. (NASDAQ:AAPL – Free Report) by 6.3% in the fourth quarter, HoldingsChannel reports. The firm owned 2,513 shares of the iPhone maker’s stock after selling 168 shares during the period. Laurel Wealth …",ETF Daily News,https://www.etfdailynews.com/2025/04/28/apple-inc-nasdaqaapl-holdings-trimmed-by-laurel-wealth-planning-llc/
AAPL,2025-04-28 07:08:48+00:00,Meitav Investment House Ltd. Reduces Stock Position in Apple Inc. (NASDAQ:AAPL),"Meitav Investment House Ltd. reduced its position in Apple Inc. (NASDAQ:AAPL – Free Report) by 28.4% in the fourth quarter, Holdings Channel.com reports. The fund owned 181,414 shares of the iPhone maker’s stock after selling 72,058 shares during the quarter.…",ETF Daily News,https://www.etfdailynews.com/2025/04/28/meitav-investment-house-ltd-reduces-stock-position-in-apple-inc-nasdaqaapl/
AAPL,2025-04-28 07:08:48+00:00,"Boston Financial Mangement LLC Buys 3,248 Shares of Apple Inc. (NASDAQ:AAPL)","Boston Financial Mangement LLC boosted its position in Apple Inc. (NASDAQ:AAPL – Free Report) by 0.5% during the fourth quarter, HoldingsChannel.com reports. The institutional investor owned 716,496 shares of the iPhone maker’s stock after acquiring an additi…",ETF Daily News,https://www.etfdailynews.com/2025/04/28/boston-financial-mangement-llc-buys-3248-shares-of-apple-inc-nasdaqaapl/
AAPL,2025-04-28 06:04:43+00:00,Promising Technology Stocks To Research – April 26th,"NVIDIA, Meta Platforms, Alphabet, Apple, and Microsoft are the five Technology stocks to watch today, according to MarketBeat’s stock screener tool. Error: Response status code does not indicate success: 429 (Too Many Requests). These companies had the highes…",ETF Daily News,https://www.etfdailynews.com/2025/04/28/promising-technology-stocks-to-research-april-26th/
AAPL,2025-04-28 02:06:01+00:00,"Prediction: This Stock Will Be Worth More Than Nvidia, Microsoft, and Apple 5 Years From Now",Two companies have sat at or near the top of the list of the world's most valuable companies for the better part of a decade: Apple (AAPL 0.41%) and Microsoft (MSFT 1.21%). The longtime tech giants were recently joined at the top of the list by Nvidia (NVDA 4…,Biztoc.com,https://biztoc.com/x/972bbac035b13e44
AAPL,2025-04-27 23:49:59+00:00,"Stock market today: S&P 500, Dow, Nasdaq futures slip ahead of huge week of Big Tech earnings, economic data",US futures slip slightly with investors focused on Big Tech earnings for the week ahead.,Yahoo Entertainment,https://finance.yahoo.com/news/live/stock-market-today-sp-500-dow-nasdaq-futures-slip-ahead-of-huge-week-of-big-tech-earnings-economic-data-234959158.html
AAPL,2025-04-27 23:49:59+00:00,"Stock market today: S&P 500, Dow, Nasdaq futures flat ahead of huge week of Big Tech earnings, economic data",US futures were flat on Monday with investors focused on Big Tech earnings for the week ahead.,Yahoo Entertainment,https://finance.yahoo.com/news/live/stock-market-today-sp-500-dow-nasdaq-futures-flat-ahead-of-huge-week-of-big-tech-earnings-economic-data-234959646.html
AAPL,2025-04-27 20:22:02+00:00,the Most Profitable Blue Chip Stock to Buy Now?,"In This Article:
We recently published a list of 10 Most Profitable Blue Chip Stocks to Buy Now. In this article, we are going to take a look at where Apple Inc. (AAPL) stands against other most profitable blue chip stocks to buy now.
Blue chip stocks are lar…",Biztoc.com,https://biztoc.com/x/11f449ab20e8343d
AAPL,2025-04-27 20:07:56+00:00,Is Apple Inc. (AAPL) the Most Profitable Blue Chip Stock to Buy Now?,"We recently published a list of 10 Most Profitable Blue Chip Stocks to Buy Now. In this article, we are going to take a look at where Apple Inc. (AAPL...",Yahoo Entertainment,https://finance.yahoo.com/news/apple-inc-aapl-most-profitable-200756562.html
AAPL,2025-04-27 17:02:23+00:00,Apple's goal this week: Prove it still has its mojo,"Admittedly, to say Apple has something to prove in this week's earnings report smacks of arrogance. 
But there you have it. Apple (AAPL) , which sports the richest market capitalization of any stock in the world, has seen its stock struggle this year. 
 D…",Biztoc.com,https://biztoc.com/x/c7bf2426cc24196b
AAPL,2025-04-27 16:48:15+00:00,Apple's goal this week: Prove it still has its mojo,"The tech giant's earnings report is one of hundreds due this week, the busiest week in an earnings season driven by volatility.",TheStreet,https://www.thestreet.com/investing/stocks/apples-goal-this-week-prove-it-still-has-its-mojo
AAPL,2025-04-27 11:35:03+00:00,"April jobs report, Big Tech earnings in focus amid stock market recovery: What to know this week","With the stock market in all-out rally mode for the first time since President Trump's tariff announcements, key updates on the health of the US economy and ...",Yahoo Entertainment,https://finance.yahoo.com/news/april-jobs-report-big-tech-earnings-in-focus-amid-stock-market-recovery-what-to-know-this-week-113503429.html
AAPL,2025-04-27 11:00:00+00:00,A Possible Recession Clue And Earnings Bonanza Upcoming,"Removing the tariff noise from economic and earnings releases will take effort. While a recession signal is unlikely, there should be signs of further economic softening.",Forbes,https://www.forbes.com/sites/bill_stone/2025/04/27/a-possible-recession-clue-and-earnings-bonanza-upcoming/
AAPL,2025-04-27 07:45:03+00:00,"Good Life Advisors LLC Sells 3,127 Shares of Apple Inc. (NASDAQ:AAPL)","Good Life Advisors LLC cut its position in shares of Apple Inc. (NASDAQ:AAPL – Free Report) by 1.7% during the 4th quarter, according to the company in its most recent filing with the SEC. The firm owned 176,738 shares of the iPhone maker’s stock after sellin…",ETF Daily News,https://www.etfdailynews.com/2025/04/27/good-life-advisors-llc-sells-3127-shares-of-apple-inc-nasdaqaapl/
AAPL,2025-04-27 07:45:03+00:00,"TBH Global Asset Management LLC Sells 4,363 Shares of Apple Inc. (NASDAQ:AAPL)","TBH Global Asset Management LLC cut its holdings in shares of Apple Inc. (NASDAQ:AAPL – Free Report) by 2.3% in the fourth quarter, according to its most recent filing with the Securities and Exchange Commission. The fund owned 182,462 shares of the iPhone ma…",ETF Daily News,https://www.etfdailynews.com/2025/04/27/tbh-global-asset-management-llc-sells-4363-shares-of-apple-inc-nasdaqaapl/
AAPL,2025-04-27 07:45:03+00:00,Apple Inc. (NASDAQ:AAPL) Shares Sold by FMA Wealth Management LLC,"FMA Wealth Management LLC decreased its position in shares of Apple Inc. (NASDAQ:AAPL – Free Report) by 9.4% in the fourth quarter, according to its most recent Form 13F filing with the Securities & Exchange Commission. The firm owned 9,376 shares of the iPho…",ETF Daily News,https://www.etfdailynews.com/2025/04/27/apple-inc-nasdaqaapl-shares-sold-by-fma-wealth-management-llc/
AAPL,2025-04-27 07:45:02+00:00,ICICI Prudential Asset Management Co Ltd Grows Stock Holdings in Apple Inc. (NASDAQ:AAPL),"ICICI Prudential Asset Management Co Ltd boosted its position in Apple Inc. (NASDAQ:AAPL – Free Report) by 4.1% in the fourth quarter, HoldingsChannel reports. The firm owned 80,009 shares of the iPhone maker’s stock after buying an additional 3,164 shares du…",ETF Daily News,https://www.etfdailynews.com/2025/04/27/icici-prudential-asset-management-co-ltd-grows-stock-holdings-in-apple-inc-nasdaqaapl/
AAPL,2025-04-27 07:45:02+00:00,Apple Inc. (NASDAQ:AAPL) Position Cut by Satovsky Asset Management LLC,"Satovsky Asset Management LLC cut its position in Apple Inc. (NASDAQ:AAPL – Free Report) by 0.7% in the fourth quarter, according to its most recent Form 13F filing with the Securities and Exchange Commission. The institutional investor owned 56,727 shares of…",ETF Daily News,https://www.etfdailynews.com/2025/04/27/apple-inc-nasdaqaapl-position-cut-by-satovsky-asset-management-llc/
AAPL,2025-04-27 07:45:00+00:00,Apple Inc. (NASDAQ:AAPL) Shares Sold by Freedom Day Solutions LLC,"Freedom Day Solutions LLC lowered its holdings in shares of Apple Inc. (NASDAQ:AAPL – Free Report) by 2.2% during the fourth quarter, according to its most recent disclosure with the Securities and Exchange Commission. The institutional investor owned 42,845 …",ETF Daily News,https://www.etfdailynews.com/2025/04/27/apple-inc-nasdaqaapl-shares-sold-by-freedom-day-solutions-llc/
AAPL,2025-04-27 07:08:44+00:00,Financial Sense Advisors Inc. Cuts Stock Holdings in Apple Inc. (NASDAQ:AAPL),"Financial Sense Advisors Inc. lessened its holdings in Apple Inc. (NASDAQ:AAPL – Free Report) by 2.3% in the 4th quarter, according to its most recent filing with the SEC. The firm owned 7,094 shares of the iPhone maker’s stock after selling 165 shares during…",ETF Daily News,https://www.etfdailynews.com/2025/04/27/financial-sense-advisors-inc-cuts-stock-holdings-in-apple-inc-nasdaqaapl/
AAPL,2025-04-27 07:08:43+00:00,Jessup Wealth Management Inc Increases Position in Apple Inc. (NASDAQ:AAPL),"Jessup Wealth Management Inc boosted its holdings in Apple Inc. (NASDAQ:AAPL – Free Report) by 1.1% in the fourth quarter, according to the company in its most recent Form 13F filing with the SEC. The institutional investor owned 94,408 shares of the iPhone m…",ETF Daily News,https://www.etfdailynews.com/2025/04/27/jessup-wealth-management-inc-increases-position-in-apple-inc-nasdaqaapl/
AAPL,2025-04-27 07:08:43+00:00,Hapanowicz & Associates Financial Services Inc Boosts Position in Apple Inc. (NASDAQ:AAPL),"Hapanowicz & Associates Financial Services Inc increased its position in shares of Apple Inc. (NASDAQ:AAPL – Free Report) by 6.4% during the 4th quarter, according to the company in its most recent 13F filing with the Securities and Exchange Commission. The f…",ETF Daily News,https://www.etfdailynews.com/2025/04/27/hapanowicz-associates-financial-services-inc-boosts-position-in-apple-inc-nasdaqaapl/
AAPL,2025-04-27 04:17:18+00:00,"If You Invested $10K In Apple Stock 10 Years Ago, How Much Would You Have Now?",,Benzinga,https://www.benzinga.com/personal-finance/25/04/45028360/if-you-invested-10k-in-apple-stock-10-years-ago-how-much-would-you-have-now
AAPL,2025-04-26 14:13:54+00:00,Warren Buffett’s Wealth Surges $24 Billion As Tech Gets Hammered,"Warren Buffett does not own shares in the Magnificent Seven except for Apple (NASDAQ: AAPL). Over the last several quarters, he has looked like a genius as he has cut his ownership of Apple’s shares. For example, Tesla’s (NASDAQ: TSLA) stock is down 29% this …",Biztoc.com,https://biztoc.com/x/34a35948627b81da
AAPL,2025-04-26 12:33:30+00:00,"Dow Jones Futures: Apple, Amazon, Meta Lead Earnings Wave In Trump Tariff Rally","Dow Jones futures will open Sunday evening, along with S&P 500 futures and Nasdaq futures. Megacaps Meta Platforms (META), Microsoft (MSFT), Apple (AAPL) and Amazon.com (AMZN) report this coming week, along with a slew of other names. The stock market rose sh…",Biztoc.com,https://biztoc.com/x/983ad2026cf9c21d
AAPL,2025-04-26 09:41:30+00:00,Spock And The Logic Based Approach To Volatility,"Inside This Week's Bull Bear Report


<ul><!-- wp:list-item -->

<li>How Being Like Spock Can Help You Win The Investing Game</li>




<li>How We Are Trading It</li>




<li>Research Report - Speculator Vs Investor</li>




<li>YouTube - Before The Bel…",Realinvestmentadvice.com,https://realinvestmentadvice.com/resources/blog/spock-and-the-logic-based-approach-to-volatility/
AAPL,2025-04-26 08:32:51+00:00,The Goldman Sachs Group Cuts Apple (NASDAQ:AAPL) Price Target to $256.00,"Apple (NASDAQ:AAPL – Free Report) had its price target trimmed by The Goldman Sachs Group from $259.00 to $256.00 in a report released on Wednesday morning,Benzinga reports. The firm currently has a buy rating on the iPhone maker’s stock. Other research analy…",ETF Daily News,https://www.etfdailynews.com/2025/04/26/the-goldman-sachs-group-cuts-apple-nasdaqaapl-price-target-to-256-00/
AAPL,2025-04-26 07:49:07+00:00,Plan Group Financial LLC Has $1.87 Million Stock Position in Apple Inc. (NASDAQ:AAPL),"Plan Group Financial LLC lowered its position in Apple Inc. (NASDAQ:AAPL – Free Report) by 2.0% during the fourth quarter, HoldingsChannel.com reports. The firm owned 7,475 shares of the iPhone maker’s stock after selling 154 shares during the quarter. Apple …",ETF Daily News,https://www.etfdailynews.com/2025/04/26/plan-group-financial-llc-has-1-87-million-stock-position-in-apple-inc-nasdaqaapl/
AAPL,2025-04-26 07:49:06+00:00,Lyell Wealth Management LP Buys 438 Shares of Apple Inc. (NASDAQ:AAPL),"Lyell Wealth Management LP increased its stake in Apple Inc. (NASDAQ:AAPL – Free Report) by 0.2% in the 4th quarter, Holdings Channel reports. The firm owned 185,415 shares of the iPhone maker’s stock after purchasing an additional 438 shares during the perio…",ETF Daily News,https://www.etfdailynews.com/2025/04/26/lyell-wealth-management-lp-buys-438-shares-of-apple-inc-nasdaqaapl/
AAPL,2025-04-26 07:49:04+00:00,Apple Inc. (NASDAQ:AAPL) Shares Acquired by Bigelow Investment Advisors LLC,"Bigelow Investment Advisors LLC raised its holdings in Apple Inc. (NASDAQ:AAPL – Free Report) by 0.5% in the 4th quarter, Holdings Channel reports. The institutional investor owned 28,329 shares of the iPhone maker’s stock after acquiring an additional 151 sh…",ETF Daily News,https://www.etfdailynews.com/2025/04/26/apple-inc-nasdaqaapl-shares-acquired-by-bigelow-investment-advisors-llc/
AAPL,2025-04-26 07:49:03+00:00,Apple Inc. (NASDAQ:AAPL) is Wilkinson Global Asset Management LLC’s 3rd Largest Position,"Wilkinson Global Asset Management LLC lessened its position in shares of Apple Inc. (NASDAQ:AAPL – Free Report) by 0.8% during the fourth quarter, HoldingsChannel reports. The institutional investor owned 445,456 shares of the iPhone maker’s stock after selli…",ETF Daily News,https://www.etfdailynews.com/2025/04/26/apple-inc-nasdaqaapl-is-wilkinson-global-asset-management-llcs-3rd-largest-position/
